{
  "llmfeed_export": true,
  "origin": "https://github.com/wellknownmcp/llmfeed-spec",
  "created_at": "2025-04-28T00:00:00Z",
  "description": "The official specification repository for the Model Context Protocol (MCP) and LLMFeed format, enabling structured, signed, and agent-compatible context feeds.",
  "keywords": [
    "mcp",
    "llmfeed",
    "open-standard",
    "ai-agents",
    "context-protocol"
  ],
  "audience": [
    "llm-agents",
    "humans",
    "developers"
  ],
  "scope": [
    "global",
    "github-repositories"
  ],
  "trust_level": "certified",
  "capabilities": "https://github.com/wellknownmcp/llmfeed-spec/examples/capabilities-example.json",
  "user": {
    "id": "anonymous",
    "authenticated": false
  },
  "data": {
    "feed_version": "1.0",
    "content_summary": "This feed describes the public resources and specifications related to the MCP and LLMFeed standards, providing links, documentation, and examples for developers and autonomous agents.",
    "primary_resources": [
      "https://github.com/wellknownmcp/llmfeed-spec/docs",
      "https://github.com/wellknownmcp/llmfeed-spec/.well-known",
      "https://github.com/wellknownmcp/llmfeed-spec/examples"
    ]
  },
  "mcp_metadata": {
    "mcp_enabled": true,
    "endpoint": "https://github.com/wellknownmcp/llmfeed-spec/.well-known/mcp.json",
    "example_feeds": [
      "https://github.com/wellknownmcp/llmfeed-spec/examples/llmfeed-example.json"
    ],
    "api_key_required": false
  },
  "signature": {
    "algorithm": "ed25519",
    "public_key_hint": "https://github.com/wellknownmcp/llmfeed-spec/.well-known/public.pem",
    "value": "MOCK_SIGNATURE_EXAMPLE",
    "issued_at": "2025-04-28T00:00:00Z",
    "certificate_chain": {
      "certificate_by": "https://llmca.org",
      "cert_signature": "MOCK_CERT_SIGNATURE_EXAMPLE",
      "cert_issued_at": "2025-04-28T00:00:00Z",
      "certification_level": "gold",
      "policy_reference": "https://llmca.org/.well-known/certification-policy.json",
      "audit_reference": "https://llmca.org/.well-known/audit-reference.json"
    }
  }
}
